[
  {
    "person_id": "algeria:staff:vladimir-petkovic",
    "person_type": "coach",
    "competition_id": "fifa_world_cup",
    "season_id": "2026",
    "display_name": "Vladimir Petkovic",
    "name": "Vladimir Petkovic",
    "name_zh": null,
    "country_code": null,
    "country_name": null,
    "country_name_zh": null,
    "photo_url": null,
    "team_id": "algeria",
    "team_name": "Algeria",
    "role": "head_coach",
    "role_zh": "主教练",
    "direct": {
      "staff_id": "algeria:staff:vladimir-petkovic",
      "status": "active",
      "nationality": null,
      "date_of_birth": null,
      "age": null,
      "appointed_at": null,
      "contract_until": null
    },
    "derived": {
      "status": "pending_source",
      "sample_size_matches": 0,
      "window": null,
      "competition_scope": null,
      "metrics": {}
    },
    "distilled": {
      "distillation_status": "insufficient_sample",
      "sample_size_matches": 0,
      "style_tags": [],
      "summary": null
    },
    "kpis": [
      {
        "key": "role",
        "label": "Role",
        "label_zh": "身份",
        "value": "主教练",
        "unit": null,
        "data_tier": "direct",
        "data_tier_label": "direct",
        "status": "available"
      },
      {
        "key": "team",
        "label": "Team",
        "label_zh": "球队",
        "value": "Algeria",
        "unit": null,
        "data_tier": "direct",
        "data_tier_label": "direct",
        "status": "available"
      },
      {
        "key": "derived_record",
        "label": "Derived record",
        "label_zh": "派生战绩",
        "value": null,
        "unit": null,
        "data_tier": "derived",
        "data_tier_label": "derived",
        "status": "pending_source"
      },
      {
        "key": "style_profile",
        "label": "Style profile",
        "label_zh": "风格画像",
        "value": "insufficient_sample",
        "unit": null,
        "data_tier": "distilled",
        "data_tier_label": "distilled",
        "status": "insufficient_sample"
      }
    ],
    "sections": [
      {
        "type": "identity",
        "data_tier": "direct",
        "status": "available",
        "fields": {
          "source_status": "official_fifa",
          "sources": [
            "official_fifa"
          ],
          "source_urls": [
            "https://www.fifa.com/en/tournaments/mens/worldcup/canadamexicousa2026/articles/coaches-react-draw"
          ],
          "source_refs": {
            "source_url": "https://www.fifa.com/en/tournaments/mens/worldcup/canadamexicousa2026/articles/coaches-react-draw"
          },
          "updated_at": "2026-05-17T00:00:00Z"
        }
      },
      {
        "type": "career_summary",
        "data_tier": "derived",
        "status": "pending_source",
        "basis": {
          "sample_size_matches": 0
        }
      },
      {
        "type": "style_distillation",
        "data_tier": "distilled",
        "status": "insufficient_sample",
        "basis": {
          "sample_size_matches": 0,
          "minimum_required": 30
        }
      }
    ],
    "data_tiers": [
      "direct",
      "derived",
      "distilled"
    ],
    "source_status": "official_fifa",
    "sources": [
      "official_fifa"
    ],
    "source_urls": [
      "https://www.fifa.com/en/tournaments/mens/worldcup/canadamexicousa2026/articles/coaches-react-draw"
    ],
    "source_refs": {
      "source_url": "https://www.fifa.com/en/tournaments/mens/worldcup/canadamexicousa2026/articles/coaches-react-draw"
    },
    "updated_at": "2026-05-17T00:00:00Z"
  },
  {
    "person_id": "argentina:staff:lionel-scaloni",
    "person_type": "coach",
    "competition_id": "fifa_world_cup",
    "season_id": "2026",
    "display_name": "Lionel Scaloni",
    "name": "Lionel Scaloni",
    "name_zh": null,
    "country_code": null,
    "country_name": null,
    "country_name_zh": null,
    "photo_url": null,
    "team_id": "argentina",
    "team_name": "Argentina",
    "role": "head_coach",
    "role_zh": "主教练",
    "direct": {
      "staff_id": "argentina:staff:lionel-scaloni",
      "status": "active",
      "nationality": null,
      "date_of_birth": null,
      "age": null,
      "appointed_at": null,
      "contract_until": null
    },
    "derived": {
      "status": "pending_source",
      "sample_size_matches": 0,
      "window": null,
      "competition_scope": null,
      "metrics": {}
    },
    "distilled": {
      "distillation_status": "insufficient_sample",
      "sample_size_matches": 0,
      "style_tags": [],
      "summary": null
    },
    "kpis": [
      {
        "key": "role",
        "label": "Role",
        "label_zh": "身份",
        "value": "主教练",
        "unit": null,
        "data_tier": "direct",
        "data_tier_label": "direct",
        "status": "available"
      },
      {
        "key": "team",
        "label": "Team",
        "label_zh": "球队",
        "value": "Argentina",
        "unit": null,
        "data_tier": "direct",
        "data_tier_label": "direct",
        "status": "available"
      },
      {
        "key": "derived_record",
        "label": "Derived record",
        "label_zh": "派生战绩",
        "value": null,
        "unit": null,
        "data_tier": "derived",
        "data_tier_label": "derived",
        "status": "pending_source"
      },
      {
        "key": "style_profile",
        "label": "Style profile",
        "label_zh": "风格画像",
        "value": "insufficient_sample",
        "unit": null,
        "data_tier": "distilled",
        "data_tier_label": "distilled",
        "status": "insufficient_sample"
      }
    ],
    "sections": [
      {
        "type": "identity",
        "data_tier": "direct",
        "status": "available",
        "fields": {
          "source_status": "official_fifa",
          "sources": [
            "official_fifa"
          ],
          "source_urls": [
            "https://www.fifa.com/es/articles/seleccion-argentina-mundial-estadisticas-numeros-historia-perfil"
          ],
          "source_refs": {
            "source_url": "https://www.fifa.com/es/articles/seleccion-argentina-mundial-estadisticas-numeros-historia-perfil"
          },
          "updated_at": "2026-05-17T00:00:00Z"
        }
      },
      {
        "type": "career_summary",
        "data_tier": "derived",
        "status": "pending_source",
        "basis": {
          "sample_size_matches": 0
        }
      },
      {
        "type": "style_distillation",
        "data_tier": "distilled",
        "status": "insufficient_sample",
        "basis": {
          "sample_size_matches": 0,
          "minimum_required": 30
        }
      }
    ],
    "data_tiers": [
      "direct",
      "derived",
      "distilled"
    ],
    "source_status": "official_fifa",
    "sources": [
      "official_fifa"
    ],
    "source_urls": [
      "https://www.fifa.com/es/articles/seleccion-argentina-mundial-estadisticas-numeros-historia-perfil"
    ],
    "source_refs": {
      "source_url": "https://www.fifa.com/es/articles/seleccion-argentina-mundial-estadisticas-numeros-historia-perfil"
    },
    "updated_at": "2026-05-17T00:00:00Z"
  },
  {
    "person_id": "australia:staff:tony-popovic",
    "person_type": "coach",
    "competition_id": "fifa_world_cup",
    "season_id": "2026",
    "display_name": "Tony Popovic",
    "name": "Tony Popovic",
    "name_zh": null,
    "country_code": null,
    "country_name": null,
    "country_name_zh": null,
    "photo_url": null,
    "team_id": "australia",
    "team_name": "Australia",
    "role": "head_coach",
    "role_zh": "主教练",
    "direct": {
      "staff_id": "australia:staff:tony-popovic",
      "status": "active",
      "nationality": null,
      "date_of_birth": null,
      "age": null,
      "appointed_at": null,
      "contract_until": null
    },
    "derived": {
      "status": "pending_source",
      "sample_size_matches": 0,
      "window": null,
      "competition_scope": null,
      "metrics": {}
    },
    "distilled": {
      "distillation_status": "insufficient_sample",
      "sample_size_matches": 0,
      "style_tags": [],
      "summary": null
    },
    "kpis": [
      {
        "key": "role",
        "label": "Role",
        "label_zh": "身份",
        "value": "主教练",
        "unit": null,
        "data_tier": "direct",
        "data_tier_label": "direct",
        "status": "available"
      },
      {
        "key": "team",
        "label": "Team",
        "label_zh": "球队",
        "value": "Australia",
        "unit": null,
        "data_tier": "direct",
        "data_tier_label": "direct",
        "status": "available"
      },
      {
        "key": "derived_record",
        "label": "Derived record",
        "label_zh": "派生战绩",
        "value": null,
        "unit": null,
        "data_tier": "derived",
        "data_tier_label": "derived",
        "status": "pending_source"
      },
      {
        "key": "style_profile",
        "label": "Style profile",
        "label_zh": "风格画像",
        "value": "insufficient_sample",
        "unit": null,
        "data_tier": "distilled",
        "data_tier_label": "distilled",
        "status": "insufficient_sample"
      }
    ],
    "sections": [
      {
        "type": "identity",
        "data_tier": "direct",
        "status": "available",
        "fields": {
          "source_status": "official_fifa",
          "sources": [
            "official_fifa"
          ],
          "source_urls": [
            "https://www.fifa.com/en/tournaments/mens/worldcup/canadamexicousa2026/articles/australia-team-profile-history"
          ],
          "source_refs": {
            "source_url": "https://www.fifa.com/en/tournaments/mens/worldcup/canadamexicousa2026/articles/australia-team-profile-history"
          },
          "updated_at": "2026-05-17T00:00:00Z"
        }
      },
      {
        "type": "career_summary",
        "data_tier": "derived",
        "status": "pending_source",
        "basis": {